{
  "base_main_sha": "4a3605249dae6f22954aa3051541642ae47e3a53",
  "code_manifest": [
    {
      "path": "requirements-analysis.txt",
      "sha256": "6f43be18e18d9da787f02e584497e04d79d98d2b4e99a65d05bb136e3fcd6778"
    },
    {
      "path": "requirements-osm.txt",
      "sha256": "0171972f586b82e8250658391790643f55cee9c191a7f85a7838d948c8872c8c"
    },
    {
      "path": "schemas/champion-event.json",
      "sha256": "577c07a2c882fef5ba0e168036767694762dc917ab2caa750fbf8cc27671a08b"
    },
    {
      "path": "schemas/champion-model.json",
      "sha256": "9ecf109ebf30951c10683ab8ffb0f36b15fa787f0b1d8cf3a38b8d6216c87ff3"
    },
    {
      "path": "schemas/codex-cycle-contract.json",
      "sha256": "e9cf542fb83babc46e2eb0b24329dc19b4efc3ed7fea71bc4a546103bd5bf8ac"
    },
    {
      "path": "schemas/master-evidence-manifest.json",
      "sha256": "a284971bcb746f0bd096dc51d2aea4b9a187ca50e2cde812e27556af0b223917"
    },
    {
      "path": "schemas/master-run-manifest.json",
      "sha256": "46b33e5b2f25b861cc7bbbae6a0c929f7e719e731160447a6bb782e578f7d89e"
    },
    {
      "path": "schemas/master-stage.json",
      "sha256": "e6c44db8a5d42c74282b67e6e30aa90536e9cb3b95ea12d6fff10a755b799645"
    },
    {
      "path": "schemas/model-learning.json",
      "sha256": "56d94fda67cfb6268e9032b6374fa056e060cb28ed6ca447188c05e1ed1f15d4"
    },
    {
      "path": "scripts/acquire_exante_weather.py",
      "sha256": "4c718e5b6dfc67da8579eebcb2edf006068f0b6f951429fe28a22f751273f3d1"
    },
    {
      "path": "scripts/audit_aug31_road_search_candidates.py",
      "sha256": "9e8dfa4713c3ad12c3d344a3a727b4dcb691f34f7641a0e3ca2ad3b44e78ee43"
    },
    {
      "path": "scripts/audit_august_75_fauna_motion_review.py",
      "sha256": "cdc5483510a008a710e114ac176fe6d25ea3eb6bcbb28c58162bda699bc9c2d6"
    },
    {
      "path": "scripts/audit_august_fauna_sighting_context.py",
      "sha256": "99cf785a118431ca0b3c53742affcb346ee90e21255525876506aa91ea24b1b8"
    },
    {
      "path": "scripts/audit_august_native_capture_original.py",
      "sha256": "e8628ea9e3aa469ba0cbea2f5dabe1dfd015cd1f8f6b07a58b6c7f16e0c3d76d"
    },
    {
      "path": "scripts/audit_august_sampled_exposure.py",
      "sha256": "3c821293e0950f6d8c09d209329adc888803b203c2e080705a664763afb355ad"
    },
    {
      "path": "scripts/audit_p0_exante_assets.py",
      "sha256": "697be9e41dfc023cde4b792c03e4b190408bd2547013750b7f4e618bc3f3866e"
    },
    {
      "path": "scripts/audit_remaining_august_road_candidates.py",
      "sha256": "e6f7d3cd804cc0bd27a1da8bf4f052376ffe6d9fb6bd93797562bce87de80983"
    },
    {
      "path": "scripts/build_august_evidence_review_queue.py",
      "sha256": "c5cf182859dd17a53f5fdf3b81fa24ef785c2a03a694dc1bd5d6d800a4a54d70"
    },
    {
      "path": "scripts/build_august_source_evidence_packets.py",
      "sha256": "cfcbb9837e259cff3fec722b4a0289387ee6e60a53fb1f61909c1672c9c742ac"
    },
    {
      "path": "scripts/build_capture_dashboard.py",
      "sha256": "7644e8f6bf32cabaeb490d08458b7dfb8b31f4ff29cb66aabfbb3d87ff0d5926"
    },
    {
      "path": "scripts/build_gpx_outcome_source_matrix.py",
      "sha256": "5e18728ae015cc546c4d0f194386e2c532b788fb7d929a71ed1a6bcbfa79e38a"
    },
    {
      "path": "scripts/check_codex_cycle.py",
      "sha256": "5592ab24503b79f1df3fef529e280fb872972b556a26b34b13de47a68b95f85a"
    },
    {
      "path": "scripts/check_codex_parallel_handoff.py",
      "sha256": "a28727a92a23b5d4d12cc2cd384d08f2ce6588a62437f64ff9a494c74f5de16b"
    },
    {
      "path": "scripts/check_p0_readiness.py",
      "sha256": "4677778fe74af2e63293b48304a32223226f0d11f066b51fd3cb247503d128d2"
    },
    {
      "path": "scripts/fetch_osm_road.py",
      "sha256": "b71b9b4ecbc40e505aeeaca9307048a7a8bfa65492bc367b487f469279c31f7f"
    },
    {
      "path": "scripts/freeze_prediction.py",
      "sha256": "11b107319a77aef48b8cf8a08113bf1efdaef9786e7bc6cced41d87f13d55762"
    },
    {
      "path": "scripts/gsi_dem_source_probe.py",
      "sha256": "e98b87297d6eb43795c41269a55aadd0999ddc5504e0709e42b021112b38f6c1"
    },
    {
      "path": "scripts/ingest_attachment.py",
      "sha256": "ce80be1ec95dc7965d62b2ad897cc8a6d4d87a0c48801ee588388d1623519c7f"
    },
    {
      "path": "scripts/inventory_real_gpx_sources.py",
      "sha256": "3ffe86b12fa7d90ccc578b98c448b46d7399a3b4e31b20af5b6303bf01688908"
    },
    {
      "path": "scripts/issue_prediction.py",
      "sha256": "331d6905a01502d2a01a22f6156467cd5f3969acf45019f40c93b09e3ef9edd5"
    },
    {
      "path": "scripts/legacy_chronological_walkforward.py",
      "sha256": "dbb7ae0a1c829512b6b3111effcd51f7680447ad3b86c6f67c904affe03f8026"
    },
    {
      "path": "scripts/live_weather_e2e.py",
      "sha256": "076103a85f717a5a4672207e483923c65b3b76afa80e27570e1d7e8d8774f31d"
    },
    {
      "path": "scripts/migrate_legacy_public_gpx.py",
      "sha256": "1a237f26673f9b4e1e79e3819b38602316d2ebb5bd46b7dda0981f1b5df1306f"
    },
    {
      "path": "scripts/pdca_bridge.py",
      "sha256": "03e84d9d9dcc3811827ac21b58da2bb6d030c98ff2ad2e88f36bc1626db9e1a1"
    },
    {
      "path": "scripts/reconcile_actual_gpx_exposure.py",
      "sha256": "3de366e5e8ab39339a664848a4521131bea30c82e232af4fa0b3d20cf70a525d"
    },
    {
      "path": "scripts/recover_remaining_august_nights.py",
      "sha256": "c58e85eefb3af275eadcd69d315b95c424ea208472d40d32a3f4e64a32592dfa"
    },
    {
      "path": "scripts/recover_two_habu_nights.py",
      "sha256": "8b5ce9bb05790f3f4871befd14dccaa7c93a11395f5cb3030b5492e9337d202f"
    },
    {
      "path": "scripts/register_raw_file.py",
      "sha256": "64ecaf0bf8165c2dfe24595246c5dbe9a451250b93b42a758e009d64e53d7c83"
    },
    {
      "path": "scripts/restore_line_gpx_archive.py",
      "sha256": "69752993aa5a56a7477f55f0c53fc81f5b48395192247816c073ee5ffea285d2"
    },
    {
      "path": "scripts/run_pdca.py",
      "sha256": "867b4b672de288d314733326910d7847809b65a225b7fd84caf3d510f479486c"
    },
    {
      "path": "scripts/text_safe_byte_archive.py",
      "sha256": "ffb6318384ccddf4d818ae06c857b6a5f2d6d8e70efe529657c9bd276bf5065e"
    },
    {
      "path": "scripts/verify_osm_road_archive.py",
      "sha256": "3789540826340844169e3504093372e1daec095caa1397cb87d19d0a16f9975f"
    },
    {
      "path": "scripts/verify_pages_access.py",
      "sha256": "4335c34bb3e1fd332a00367a5ee167ad68adc663f009977c2a42e97163249202"
    },
    {
      "path": "src/champion_registry.py",
      "sha256": "3544a642674b27b8581612c353c992b80f6c0c25b5e85819ec82eeeaffb7d523"
    },
    {
      "path": "src/codex_cycle_contract.py",
      "sha256": "459b0bd41e5f96c72e226f4707876aaab9a7b5079d9b257e4ed49d395863ea0f"
    },
    {
      "path": "src/evaluation/locked_protocol_manifest.py",
      "sha256": "b5e39f0411657cb87d49473a161d8b20fe1991e9d119915055df4b2276b386e0"
    },
    {
      "path": "src/evidence_audit.py",
      "sha256": "8c8d9aa45c46439efd6f785047ad2cf7a06951ae152570c535a883460c3b111d"
    },
    {
      "path": "src/gpx_audit.py",
      "sha256": "878ff42ec767e671bf9581ce2d1635c5282ffca469dc6f247654817b7c55779d"
    },
    {
      "path": "src/learning_snapshot.py",
      "sha256": "1d5115f8f20808ef0bfd60459777bad5c8392e6a8534cd0af9bba6756d542d53"
    },
    {
      "path": "src/master_contracts.py",
      "sha256": "8d027230f171d4ab7640689ea8e1b178cac320099c45ce97d317445e43f86686"
    },
    {
      "path": "src/master_inventory.py",
      "sha256": "4a35a05756727a651c4ccc4b61a81213a4360398ef6812ce2ed5a9c54c6cc6b7"
    },
    {
      "path": "src/master_orchestrator.py",
      "sha256": "fb978e11bd6817aaf417ab27defe4676a40e8d39e54b7c6271e59a5369d73868"
    },
    {
      "path": "src/model_evaluation.py",
      "sha256": "4a28eaae79c3b818824cfb7600963dab63d9bf248efdbc3f7a68cfb62a385602"
    },
    {
      "path": "src/models/hierarchy_shrinkage.py",
      "sha256": "85cb9beddc6128522a35e45f7695976781bd01632adce4e6415a429450131b71"
    },
    {
      "path": "src/models/occupancy_shrinkage.py",
      "sha256": "48443068e2aeaacf7f9a638a604fe72d063aa3891bc1652f713f9e60c7e34c2a"
    },
    {
      "path": "src/models/research_selection.py",
      "sha256": "915fbe3bb52cbf211c3ed7974ac805c0bb87e70bc0378837544b0081d27dd714"
    },
    {
      "path": "src/observation_eligibility_v1.py",
      "sha256": "7b682d0a4914e1c8c51b808797e03b9adf67e923deac1b055a8a6d70e18c3862"
    },
    {
      "path": "src/osm_road.py",
      "sha256": "926d026b6e8a550ad1fe443ace05656133ce05d9ceb30624f1e6331a02dbd693"
    },
    {
      "path": "src/pdca_bridge.py",
      "sha256": "5f0c730ad5ca1cb4c3733e5c84322c8ae33729868211d50d900a521bef658cc7"
    },
    {
      "path": "src/pdca_pipeline.py",
      "sha256": "4f3204fd704b6cfd7df1f199d29dbea55057eb546cd2b9c5aef1f4d5221a22cc"
    },
    {
      "path": "src/prospective_candidate_model.py",
      "sha256": "352fe5766ac6a476e55dc04407d84cf313678abb0af330348e947c8b2128a331"
    },
    {
      "path": "src/public_data.py",
      "sha256": "cd8f52d0c204d8de7760ce2b09268a8ab72b3ae4376b370dbaf91dde85d590b1"
    },
    {
      "path": "src/road_dem_join.py",
      "sha256": "b5c2d323883cde3116f164f4345b5f8f960a9a4a22022bf10176bc861bbe958d"
    },
    {
      "path": "src/terrain_road_features.py",
      "sha256": "8b28e871024bb787adf4d2c2bebf7f6c07c6ad3d3f3ffaafbfbb8209d086f934"
    }
  ],
  "cycle_id": "20261025-integration-03",
  "frozen_at": "2026-10-25T03:39:20.204925+00:00",
  "kind": "DEVELOPMENT_CONTRACT_ONLY",
  "policy_ref": {
    "path": "protocols/development/g0-policy-v1.json",
    "sha256": "79112d4f845b620ff928743cb1f6d14af62ce8bcf474f51fb32ec911d67941ac"
  },
  "schema_version": "habu-codex-cycle-v1"
}
